{"result_schema_version":1,"oracle":{"implementation":"apache-helix","helix_version":"2.0.1","helix_tag":"helix-2.0.1","commit_provenance":"tag = helix-2.0.1; commit metadata unavailable"},"operation":"inspect_state_model","state_model":{"name":"LeaderStandby","initial_state":"OFFLINE","valid":true,"top_state":"LEADER","single_top_state":true,"states_priority":["LEADER","STANDBY","OFFLINE","DROPPED"],"transition_priority":["LEADER-STANDBY","STANDBY-LEADER","OFFLINE-STANDBY","STANDBY-OFFLINE","OFFLINE-DROPPED"],"state_counts":{"LEADER":"1","STANDBY":"R","OFFLINE":"-1","DROPPED":"-1"},"next_states":[{"from":"OFFLINE","to":"STANDBY","next":"STANDBY"},{"from":"STANDBY","to":"LEADER","next":"LEADER"},{"from":"LEADER","to":"STANDBY","next":"STANDBY"},{"from":"OFFLINE","to":"DROPPED","next":"DROPPED"}]}}
